{
  "requirement_id": "req-page-selection-analysis-smoke",
  "graph_id": "graph-001",
  "root_workflow_module_id": "mod-page-selection-workflow",
  "nodes": [
    {
      "id": "chat_query",
      "module_id": null,
      "label": "chat_query",
      "node_kind": "input",
      "execution_kind": "io",
      "adk_node_role": "synthetic",
      "owner_scope": "local",
      "container_id": "container-page-selection",
      "lane_id": "input",
      "input_ports": [],
      "output_ports": [],
      "schema_refs": [],
      "review_status": "approved"
    },
    {
      "id": "scenario_design_purpose",
      "module_id": null,
      "label": "scenario_design_purpose",
      "node_kind": "input",
      "execution_kind": "io",
      "adk_node_role": "synthetic",
      "owner_scope": "local",
      "container_id": "container-page-selection",
      "lane_id": "input",
      "input_ports": [],
      "output_ports": [],
      "schema_refs": [],
      "review_status": "approved"
    },
    {
      "id": "scenario_target_business_domain",
      "module_id": null,
      "label": "scenario_target_business_domain",
      "node_kind": "input",
      "execution_kind": "io",
      "adk_node_role": "synthetic",
      "owner_scope": "local",
      "container_id": "container-page-selection",
      "lane_id": "input",
      "input_ports": [],
      "output_ports": [],
      "schema_refs": [],
      "review_status": "approved"
    },
    {
      "id": "sql_text",
      "module_id": null,
      "label": "sql_text",
      "node_kind": "input",
      "execution_kind": "io",
      "adk_node_role": "synthetic",
      "owner_scope": "local",
      "container_id": "container-page-selection",
      "lane_id": "input",
      "input_ports": [],
      "output_ports": [],
      "schema_refs": [],
      "review_status": "approved"
    },
    {
      "id": "mod-page-selection-workflow",
      "module_id": "mod-page-selection-workflow",
      "label": "page_selection_analysis_workflow",
      "node_kind": "workflow",
      "execution_kind": "graph_workflow",
      "adk_node_role": "workflow_node",
      "owner_scope": "local",
      "container_id": "container-page-selection",
      "lane_id": "local_graph",
      "input_ports": [],
      "output_ports": [],
      "schema_refs": [],
      "review_status": "approved"
    },
    {
      "id": "mod-behavior-classifier",
      "module_id": "mod-behavior-classifier",
      "label": "customer_behavior_type_classifier_agent",
      "node_kind": "agent",
      "execution_kind": "llm_single_turn",
      "adk_node_role": "workflow_node",
      "owner_scope": "local",
      "container_id": "container-page-selection",
      "lane_id": "local_graph",
      "input_ports": [],
      "output_ports": [],
      "schema_refs": [],
      "review_status": "approved"
    },
    {
      "id": "mod-page-rag-retrieval",
      "module_id": "mod-page-rag-retrieval",
      "label": "page_candidate_rag_mock_adapter",
      "node_kind": "adapter",
      "execution_kind": "mcp_tool_call",
      "adk_node_role": "workflow_node",
      "owner_scope": "local",
      "container_id": "container-page-selection",
      "lane_id": "adapter",
      "input_ports": [],
      "output_ports": [],
      "schema_refs": [
        "catalog.page_analysis.search_page_candidates.v1"
      ],
      "review_status": "approved"
    },
    {
      "id": "mod-page-decision-agent",
      "module_id": "mod-page-decision-agent",
      "label": "page_selection_decision_agent",
      "node_kind": "agent",
      "execution_kind": "llm_single_turn",
      "adk_node_role": "workflow_node",
      "owner_scope": "local",
      "container_id": "container-page-selection",
      "lane_id": "local_graph",
      "input_ports": [],
      "output_ports": [],
      "schema_refs": [],
      "review_status": "approved"
    },
    {
      "id": "mod-user-flow-analysis",
      "module_id": "mod-user-flow-analysis",
      "label": "user_flow_analysis_mock_adapter",
      "node_kind": "adapter",
      "execution_kind": "mcp_tool_call",
      "adk_node_role": "workflow_node",
      "owner_scope": "local",
      "container_id": "container-page-selection",
      "lane_id": "adapter",
      "input_ports": [],
      "output_ports": [],
      "schema_refs": [
        "catalog.page_analysis.analyze_user_flow.v1"
      ],
      "review_status": "approved"
    },
    {
      "id": "mod-behavior-scenario-analysis",
      "module_id": "mod-behavior-scenario-analysis",
      "label": "behavior_scenario_recommendation_mock_adapter",
      "node_kind": "adapter",
      "execution_kind": "mcp_tool_call",
      "adk_node_role": "workflow_node",
      "owner_scope": "local",
      "container_id": "container-page-selection",
      "lane_id": "adapter",
      "input_ports": [],
      "output_ports": [],
      "schema_refs": [
        "catalog.page_analysis.recommend_behavior_scenarios.v1"
      ],
      "review_status": "approved"
    },
    {
      "id": "mod-t2s-page-customer-analysis",
      "module_id": "mod-t2s-page-customer-analysis",
      "label": "page_customer_sql_analysis_mock_adapter",
      "node_kind": "adapter",
      "execution_kind": "mcp_tool_call",
      "adk_node_role": "workflow_node",
      "owner_scope": "local",
      "container_id": "container-page-selection",
      "lane_id": "adapter",
      "input_ports": [],
      "output_ports": [],
      "schema_refs": [
        "catalog.page_analysis.execute_page_customer_sql.v1"
      ],
      "review_status": "approved"
    },
    {
      "id": "mod-workflow2-handoff-agent",
      "module_id": "mod-workflow2-handoff-agent",
      "label": "workflow2_page_handoff_agent",
      "node_kind": "agent",
      "execution_kind": "llm_single_turn",
      "adk_node_role": "workflow_node",
      "owner_scope": "local",
      "container_id": "container-page-selection",
      "lane_id": "local_graph",
      "input_ports": [],
      "output_ports": [],
      "schema_refs": [],
      "review_status": "approved"
    },
    {
      "id": "selected_page_id",
      "module_id": null,
      "label": "selected_page_id",
      "node_kind": "output",
      "execution_kind": "io",
      "adk_node_role": "synthetic",
      "owner_scope": "local",
      "container_id": "container-page-selection",
      "lane_id": "output",
      "input_ports": [],
      "output_ports": [],
      "schema_refs": [],
      "review_status": "approved"
    },
    {
      "id": "workflow2_handoff",
      "module_id": null,
      "label": "workflow2_handoff",
      "node_kind": "output",
      "execution_kind": "io",
      "adk_node_role": "synthetic",
      "owner_scope": "local",
      "container_id": "container-page-selection",
      "lane_id": "output",
      "input_ports": [],
      "output_ports": [],
      "schema_refs": [],
      "review_status": "approved"
    }
  ],
  "edges": [
    {
      "id": "edge-001",
      "from": "chat_query",
      "to": "mod-page-selection-workflow",
      "from_port": null,
      "to_port": null,
      "edge_kind": "event_output",
      "execution_semantics": "normal_transition",
      "data_label": "user chat query",
      "schema_ref": "ChatQuery",
      "route_condition": null,
      "state_key": null,
      "artifact_key": null,
      "a2a_contract_id": null,
      "is_remote_boundary_crossing": false
    },
    {
      "id": "edge-002",
      "from": "scenario_design_purpose",
      "to": "mod-page-selection-workflow",
      "from_port": null,
      "to_port": null,
      "edge_kind": "event_output",
      "execution_semantics": "normal_transition",
      "data_label": "scenario design purpose",
      "schema_ref": "ScenarioDesignPurpose",
      "route_condition": null,
      "state_key": null,
      "artifact_key": null,
      "a2a_contract_id": null,
      "is_remote_boundary_crossing": false
    },
    {
      "id": "edge-003",
      "from": "scenario_target_business_domain",
      "to": "mod-page-selection-workflow",
      "from_port": null,
      "to_port": null,
      "edge_kind": "event_output",
      "execution_semantics": "normal_transition",
      "data_label": "target business domain",
      "schema_ref": "BusinessDomain",
      "route_condition": null,
      "state_key": null,
      "artifact_key": null,
      "a2a_contract_id": null,
      "is_remote_boundary_crossing": false
    },
    {
      "id": "edge-004",
      "from": "sql_text",
      "to": "mod-page-selection-workflow",
      "from_port": null,
      "to_port": null,
      "edge_kind": "event_output",
      "execution_semantics": "normal_transition",
      "data_label": "optional T2S SQL text",
      "schema_ref": "SqlText",
      "route_condition": null,
      "state_key": null,
      "artifact_key": null,
      "a2a_contract_id": null,
      "is_remote_boundary_crossing": false
    },
    {
      "id": "edge-005",
      "from": "mod-page-selection-workflow",
      "to": "mod-behavior-classifier",
      "from_port": null,
      "to_port": null,
      "edge_kind": "event_output",
      "execution_semantics": "normal_transition",
      "data_label": "purpose and business domain for behavior classification",
      "schema_ref": "BehaviorClassificationInput",
      "route_condition": null,
      "state_key": null,
      "artifact_key": null,
      "a2a_contract_id": null,
      "is_remote_boundary_crossing": false
    },
    {
      "id": "edge-006",
      "from": "mod-behavior-classifier",
      "to": "mod-page-rag-retrieval",
      "from_port": null,
      "to_port": null,
      "edge_kind": "event_output",
      "execution_semantics": "normal_transition",
      "data_label": "customer behavior classification for RAG",
      "schema_ref": "CustomerBehaviorClassification",
      "route_condition": null,
      "state_key": null,
      "artifact_key": null,
      "a2a_contract_id": null,
      "is_remote_boundary_crossing": false
    },
    {
      "id": "edge-007",
      "from": "mod-page-rag-retrieval",
      "to": "mod-page-decision-agent",